[
  {
    "id": "EX-1",
    "name": "Enterprise Agent Gateway（統一フロントドア）",
    "decisions": [
      "EX-D1"
    ],
    "domain": "ex-experience",
    "summary": "すべてのエージェント要求が通る単一の入口で、認証・分類・リスク判定・レート制御・監査エントリを一元適用する。Gateway を「実行面への唯一の通路」として位置づけ、すべての統制をここで一括実施する。個別エージェントは認証・リスク判定・監査エントリを持たなくてよい。"
  },
  {
    "id": "EX-2",
    "name": "業務埋め込み＋独立ワークベンチ（チャネル配置）",
    "decisions": [
      "EX-D1"
    ],
    "domain": "ex-experience",
    "summary": "日常の短い問い合わせは業務アプリ（Slack・Teams・Salesforce 画面）に埋め込み、横断調査・承認フロー・長時間タスクは計画・根拠・承認を一画面で確認できる独立ワークベンチで提供する。業務埋め込みと独立ポータルはどちらかを選ぶのではなく、タスクの性質に応じて使い分ける。"
  },
  {
    "id": "EX-3",
    "name": "チャネル非依存フロントドア",
    "decisions": [
      "EX-D1"
    ],
    "domain": "ex-experience",
    "summary": "複数チャネルから同一エージェントを呼び出せるようにチャネルアダプターで差異を吸収し、ID・スコープ・履歴・監査を一貫して管理する。チャネルアダプターは入力の正規化専用レイヤーとして分離し、ビジネスロジックや権限判定をアダプター内に書かない。"
  },
  {
    "id": "EX-4",
    "name": "信頼と価値実感のUX（定着を支える体験設計）",
    "decisions": [
      "EX-D2"
    ],
    "domain": "ex-experience",
    "summary": "エージェントの出力に根拠と確信度を付与し、人間が介入・修正しやすいインタラクションを設計し、節約した時間を即座にフィードバックすることで利用者の信頼を獲得し定着率を高めるパターンである。3つの柱で構成する。"
  },
  {
    "id": "ID-1",
    "name": "Workforce/Customer 二面分離",
    "decisions": [
      "ID-D1"
    ],
    "domain": "id-identity",
    "summary": "従業員面と顧客面をIdP・データ・実行環境・監査のすべてにおいて物理的に完全分離する。従業員IdPはOkta・Entra ID・Google Workspace、顧客IdP（CIAM）はAuth0・Okta Customer Identityで構成する。"
  },
  {
    "id": "ID-2",
    "name": "Identity Federation & OBO",
    "decisions": [
      "ID-D2"
    ],
    "domain": "id-identity",
    "summary": "依頼者本人の権限に縮退した委譲トークンで下流SaaSを呼び、権限を忠実に伝播する。OBOの核心は「エージェントが依頼者の名のもとにscopeとaudienceを限定したトークンを下流SaaSごとに動的に取得する」点にある。権限の制約はトークン取得（IdP/STS側）とSaaS側ネイティブ認可（RP側）の二段構えで実現する。委譲チェーン（user"
  },
  {
    "id": "ID-3",
    "name": "Workload / Agent Identity",
    "decisions": [
      "ID-D2"
    ],
    "domain": "id-identity",
    "summary": "自律動作するエージェントにSPIFFE/SVID規格に基づく短命証明書またはクラウドプロバイダーのマネージドIDを付与する。人間代理と自律実行を同一IDで動かすと、操作主体の曖昧さ・権限の過剰付与・動的スケールへの対応不能という3つの問題が生じる。"
  },
  {
    "id": "ID-4",
    "name": "Permission Mirror & Least-of",
    "decisions": [
      "ID-D2",
      "ID-D3"
    ],
    "domain": "id-identity",
    "summary": "委譲非対応SaaSでのフォールバックとして、各SaaSの権限状態をエージェント基盤側に同期したPermission Mirrorで本人権限に絞り込む。ただしPermission Mirrorは**権威ソースではなく近似**であり、実行時はSaaSネイティブ認可（ID-2の経路a/b）を優先する。"
  },
  {
    "id": "ID-5",
    "name": "JIT Scoped Credentials",
    "decisions": [
      "ID-D4"
    ],
    "domain": "id-identity",
    "summary": "ツール呼び出しの直前に「この顧客レコードの読み取り専用・5分間有効」といった用途限定の資格情報をブローカーから都度取得する。エージェントランタイムはクレデンシャルを保持せず、ツール呼び出し時にクレデンシャルブローカー（Vault/STS等）へ動的リクエストを送る。"
  },
  {
    "id": "ID-6",
    "name": "Zero-Trust Runtime + 中央PDP/分散PEP",
    "decisions": [
      "ID-D5"
    ],
    "domain": "id-identity",
    "summary": "社内起動でも信頼せず、すべての行為を毎回検証するゼロトラスト認可を中央PDP/分散PEPで実現する。PDP（OPA/Cedar）が「許可か・拒否か・承認要求か」を判断し、Gateway・コネクタ・ランタイムがPEPとして判断結果を強制する。"
  },
  {
    "id": "ID-7",
    "name": "Policy-as-Code Guardrail",
    "decisions": [
      "ID-D5"
    ],
    "domain": "id-identity",
    "summary": "行動可否を自然言語プロンプトでなくPolicy-as-Codeで決定論的に判定し、安全保証を実行基盤側に置く。LLMは「何をしようとしているか」を整理し、Policy Engineがallow / deny / require_approval / redactを返す。"
  },
  {
    "id": "ID-8",
    "name": "Consent & Access Transparency",
    "decisions": [
      "ID-D6"
    ],
    "domain": "id-identity",
    "summary": "エージェントがどのSaaSにどのスコープでアクセスしているかをユーザー本人が確認・同意・取り消しできるダッシュボードを提供する。初回利用時や高リスク操作時に明示的な委譲同意を取得し、付与済みスコープの一覧と即時失効の機能を備える。"
  },
  {
    "id": "RT-1",
    "name": "Hub & Spoke",
    "decisions": [
      "RT-D1"
    ],
    "domain": "rt-runtime",
    "summary": "ハブが意図分類とルーティングのみを担い、各スポークは自分の担当SaaSだけを扱う。権限はHub"
  },
  {
    "id": "RT-2",
    "name": "RACI Multi-Agent",
    "decisions": [
      "RT-D1"
    ],
    "domain": "rt-runtime",
    "summary": "RACIマトリクスを先に定義し、それに対応するエージェント構成を導出する。Accountable（A）は常に人間が担う。Consultedエージェントの関与は1ラウンドに限定して無限ループを防ぐ。デシジョンログは各フェーズの開始・終了時点でリアルタイムに記録する。"
  },
  {
    "id": "RT-3",
    "name": "Risk-Tiered Autonomy",
    "decisions": [
      "RT-D2"
    ],
    "domain": "rt-runtime",
    "summary": "操作のリスクをTier 0〜Tier 5に分類し、各Tierに対応する自律度をポリシーで強制する。リスクスコアリングはポリシーエンジン（ID-7）が担い、対象リソースのデータ分類・操作の不可逆性・影響範囲を入力としてTierを決定する。"
  },
  {
    "id": "RT-4",
    "name": "Human Approval Chain",
    "decisions": [
      "RT-D2"
    ],
    "domain": "rt-runtime",
    "summary": "組織グラフ（Workday/Entra）から上長・所管責任者・コスト所有者を動的に解決して承認を求める。承認者をコードにハードコードすると異動で宛先不明になるため、常に組織グラフから都度解決する。Slack・ServiceNowでの承認体験、不在時の代理委譲、SLAタイマー、却下理由のフィードバックまでをセットで設計する。"
  },
  {
    "id": "RT-5",
    "name": "Command Envelope",
    "decisions": [
      "RT-D3"
    ],
    "domain": "rt-runtime",
    "summary": "自然言語の意図をactor・agent・target_system・resource・action・risk_tier・requires_approval・reasonを含む構造化コマンドへ変換する。スキーマ不適合のEnvelopeは後続処理に進めない。"
  },
  {
    "id": "RT-6",
    "name": "SoR Write Boundary",
    "decisions": [
      "RT-D3"
    ],
    "domain": "rt-runtime",
    "summary": "エージェントは「何をしたいか」を提案するだけにとどめ、ドメインサービスがバリデーション・業務ルール・トランザクション管理を担ってからSoRに反映する。ドメインサービスは3つの責務を持つ：バリデーション（入力値の形式・範囲・整合性検証）、認可（ポリシーエンジンと照合）、ビジネスルール適用（SoR固有の業務制約の強制）。"
  },
  {
    "id": "RT-7",
    "name": "Enterprise Saga",
    "decisions": [
      "RT-D4"
    ],
    "domain": "rt-runtime",
    "summary": "各ステップをローカルトランザクションとして確定し、失敗時は補償アクションを逆順に実行して整合性を回復する。SaaS環境では分散トランザクション（2PC）が使えないため、冪等性キーと補償が現実的な第一選択となる。"
  },
  {
    "id": "RT-8",
    "name": "Durable Workflow",
    "decisions": [
      "RT-D4"
    ],
    "domain": "rt-runtime",
    "summary": "エージェントの処理状態をステップ境界ごとに永続化し、障害・再起動・スケールアウトをまたいで処理を継続させる。LLMの出力はアクティビティ境界で固定し、リプレイ時に再呼び出ししない。予算・時間・ステップ数の上限をワークフロー定義に組み込む。"
  },
  {
    "id": "RT-9",
    "name": "Work Queue Agent",
    "decisions": [
      "RT-D5"
    ],
    "domain": "rt-runtime",
    "summary": "エージェントを「チャットボット」ではなく「業務キューのワーカー」として設計する。人間と同じキューに並び、自律的に処理を試みて、できないタスクは人間にエスカレーションする。タスク取得時にエージェントは自身の処理スコープ（対応可能なカテゴリ・リスクレベル・権限範囲）を評価する。"
  },
  {
    "id": "RT-10",
    "name": "Event-Driven Orchestrator",
    "decisions": [
      "RT-D5"
    ],
    "domain": "rt-runtime",
    "summary": "SaaSのイベントをトリガーにエージェントを自律起動し、複数システムにまたがる処理をバックエンドで完結させる。イベントバスをシステム間の疎結合な接続点とし、エージェントはイベントの意味を解釈して適切なアクションを選択する。"
  },
  {
    "id": "RT-11",
    "name": "Project Digital Twin",
    "decisions": [
      "RT-D6"
    ],
    "domain": "rt-runtime",
    "summary": "エージェントを個人アシスタントではなく「プロジェクトに紐づく共有メンバー」として設計する。プロジェクト開始時にGraphRAGベースの共有メモリ・Slackチャンネル・Jiraボード・Boxフォルダを自動プロビジョニングし、`@Project-X-Agent`で誰でも対話できるようにする。"
  },
  {
    "id": "KM-1",
    "name": "Access-Controlled RAG",
    "decisions": [
      "KM-D1"
    ],
    "domain": "km-knowledge",
    "summary": "取り込み時に各チャンクへソースの ACL・分類・鮮度を同梱し、検索のたびに依頼者の最新権限で再評価する。退職者・異動者に「見えてはいけないものが見える」問題を根本から防ぐ。要素技術＝Hybrid Search（BM25＋ベクトル）、Reranker、Pinecone/Weaviate/Qdrant/Elasticsearch、Freshness Ranking、Citation。"
  },
  {
    "id": "KM-2",
    "name": "Access-Controlled Context Mesh",
    "decisions": [
      "KM-D1"
    ],
    "domain": "km-knowledge",
    "summary": "データを集約せず、本人の OBO トークンで各 SaaS に分散問い合わせ（フェデレーション）してリアルタイムに文脈を取得する。Context Router が各 Context Provider に並列分散し、プロバイダごとの独立タイムアウトで応答を待つ。"
  },
  {
    "id": "KM-3",
    "name": "Canonical Enterprise Object Model & Knowledge Graph",
    "decisions": [
      "KM-D2"
    ],
    "domain": "km-knowledge",
    "summary": "共通の業務オブジェクト（Customer / Employee / Project / Contract 等）に正規化し、エンティティ解決で同一人物・同一顧客を名寄せして関係を張る。完全な ETL 統合ではなく「意味的統合」------各 SaaS への参照リンクを持ち、実データは元の場所に残す------を目指す。"
  },
  {
    "id": "KM-4",
    "name": "Scoped Memory Hierarchy",
    "decisions": [
      "KM-D3"
    ],
    "domain": "km-knowledge",
    "summary": "メモリを個人・チーム・プロジェクト・部門・全社・顧客の各スコープに分離し、共有範囲を組織グラフに従わせる。退職やプロジェクト終了に連動してメモリと権限を自動で失効させ、本人が自分のメモリを消去できる権利も設計に含める。要素技術＝Memory Store、Vector DB（Namespace 分離）、ACL、TTL、Memory Review UI、Workday/Okta からのスコープ導出。落とし穴＝すべてを「全社共有メモリ」にし機密と雑多を混在させる。「速く作れるから全部共有」は技術負債ではなくセキュリティ上の欠陥である。"
  },
  {
    "id": "KM-5",
    "name": "Purpose-Bound Context Package",
    "decisions": [
      "KM-D4"
    ],
    "domain": "km-knowledge",
    "summary": "業務目的ごとに「必要な最小データ」をポリシーで定義し、トークン予算内に収まるコンテキストパッケージを生成する。コンテキストビルダーは業務要求を受け取ると目的ポリシーを参照してアクセス可能なデータと最大トークン数を決定し、DLP/分類エンジンでデータクラスを確認後、目的に許可されていないクラスのデータをフィルタリングまたはマスキングする。"
  },
  {
    "id": "KM-6",
    "name": "DLP & Redaction Boundary",
    "decisions": [
      "KM-D5"
    ],
    "domain": "km-knowledge",
    "summary": "LLM・RAG・ツール実行・ログの入出力すべての境界で DLP 検出・マスキング・トークナイゼーションを適用し、PII/シークレット/契約情報の外部送信とログへの機密データ混入を防ぐ。マスキングには不可逆マスキング（PII を `[REDACTED]` に置換）とトークナイゼーション（PII を代替トークンに置換し必要時に復元）の二種類がある。"
  },
  {
    "id": "KM-7",
    "name": "Ephemeral Secure Context Bus",
    "decisions": [
      "KM-D5"
    ],
    "domain": "km-knowledge",
    "summary": "コンテキストを隔離された推論環境で処理し、セッション終了と同時にメモリを解放・ゼロ化（zeroization）する。DLP（KM-6）が「機密を見つけて消す」汚染除去アプローチなら、こちらは「最初から何も残さない」揮発アプローチである。"
  },
  {
    "id": "IN-1",
    "name": "Enterprise Tool / MCP Gateway",
    "decisions": [
      "IN-D1"
    ],
    "domain": "in-integration",
    "summary": "エージェントが SaaS/API/MCP を直接呼ばず、企業管理の Gateway 経由で呼ぶパターン。ツールカタログ（スキーマ・権限・コスト）を管理し、有効化/無効化/版を運用制御する。MCP サーバ群は信頼境界ごとに分離して束ねる。"
  },
  {
    "id": "IN-2",
    "name": "SaaS Connector Adapter（腐敗防止）",
    "decisions": [
      "IN-D2"
    ],
    "domain": "in-integration",
    "summary": "各 SaaS の独自 API 仕様・認証・データモデルを、エージェントが扱う共通インターフェイスに変換するアダプタ層。Salesforce の REST、Workday の SOAP、ServiceNow の Table API の差をアダプタに閉じ込め、エージェントには業務語彙だけを見せる腐敗防止層（Anti-Corruption Layer）。"
  },
  {
    "id": "IN-3",
    "name": "Rate / Quota Broker（レート/クォータ調停）",
    "decisions": [
      "IN-D3"
    ],
    "domain": "in-integration",
    "summary": "全エージェントの SaaS API 呼び出しを Rate Broker 経由にし、SaaS ごとにトークンバケットを管理する。対話（優先高）とバッチ（優先低）で公平に枠を配分し、429 発生時は集中リトライで制御する調停レイヤー。"
  },
  {
    "id": "IN-4",
    "name": "Existing iPaaS Reuse（既存統合資産の再利用）",
    "decisions": [
      "IN-D2"
    ],
    "domain": "in-integration",
    "summary": "既存の MuleSoft/Workato/Boomi/社内 ESB の統合フローを MCP アダプターでラップし、Tool Gateway 経由で呼び出すパターン。iPaaS で運用中のフローは接続設定・変換ロジック・エラーハンドリング・監視の4つが作り込まれた資産であり、ゼロから作り直すのは二重投資になる。"
  },
  {
    "id": "GV-1",